{
  "decision_id": "decision.ops.0001",
  "status": "approved",
  "selected_proposal_id": "proposal.reroute.0001",
  "selected_action": {
    "action_type": "reroute_shipment",
    "parameters": {
      "shipment_id": "shipment.88421",
      "new_route": "route.alt-texas-02"
    }
  },
  "approval_status": "approved",
  "approval_id": "approval.ops.0001",
  "approvals": [
    {
      "approver": {
        "actor_id": "human.ops-manager-01",
        "actor_type": "human",
        "roles": ["operator"],
        "capabilities": ["approval.respond", "proposal.approve"]
      },
      "status": "approved"
    }
  ],
  "approval_chain": [
    {
      "sequence": 1,
      "action": "approved",
      "actor": {
        "actor_id": "human.ops-manager-01",
        "actor_type": "human",
        "roles": ["operator"],
        "capabilities": ["approval.respond", "proposal.approve"]
      },
      "at": "2026-03-08T11:24:00Z"
    }
  ],
  "created_at": "2026-03-08T11:23:30Z"
}
